{
  "bundle_contract": "baseline_primary_document_bundle@0.2.0",
  "description": "Synthetic plain-text primary-document bundle (ADR-097). Every CIK, accession and document is invented for methodological testing; no real filing data. Each entry's admission evidence is the acquisition-time record, forwarded by the packet builder rather than re-derived.",
  "provenance": {
    "carrier_run_id": "synthetic-fixture-carrier",
    "carrier_manifest_sha256": "0000000000000000000000000000000000000000000000000000000000000000",
    "freeze_record_sha256": "0000000000000000000000000000000000000000000000000000000000000000",
    "acquisition_run_id": "synthetic-plain-text-fixture"
  },
  "route_validation": {
    "probe_run_id": "synthetic-fixture-probe",
    "probe_manifest_sha256": "0000000000000000000000000000000000000000000000000000000000000000",
    "covered_accessions": 1,
    "note": "Synthetic route-validation placeholder: URL-route grammar only, and never selection evidence for any firm in this bundle."
  },
  "documents": [
    {
      "cik": "0009300101",
      "accession": "0009300101-22-000001",
      "form": "10-K",
      "stratum": "domestic",
      "baseline_filing_date": "2022-03-01",
      "local_filename": "text-10k-item1a.txt",
      "source_sha256": "c1f97ccdee050718afcdb2be868503b13b40e4ef6786fd1653851ed9840a692a",
      "source_byte_length": 466,
      "filing_index_url": "https://www.sec.gov/Archives/edgar/data/9300101/000930010122000001/0009300101-22-000001-index.htm",
      "filing_index_response_sha256": "0000000000000000000000000000000000000000000000000000000000000000",
      "selected_document": "10k2021.txt",
      "primary_url": "https://www.sec.gov/Archives/edgar/data/9300101/000930010122000001/10k2021.txt",
      "representation": "plain_text",
      "admission": "single_sgml_document",
      "document_blocks": 1,
      "declared_type": "10-K",
      "declared_filename": "10k2021.txt"
    },
    {
      "cik": "0009300102",
      "accession": "0009300102-22-000002",
      "form": "10-KT",
      "stratum": "domestic",
      "baseline_filing_date": "2022-04-01",
      "local_filename": "text-10kt-item1b.txt",
      "source_sha256": "7014159e50fccd36e774dfa89bb841e3271962b4e571b0484ae66ade2dfc6e99",
      "source_byte_length": 401,
      "filing_index_url": "https://www.sec.gov/Archives/edgar/data/9300102/000930010222000002/0009300102-22-000002-index.htm",
      "filing_index_response_sha256": "0000000000000000000000000000000000000000000000000000000000000000",
      "selected_document": "10kt2021.txt",
      "primary_url": "https://www.sec.gov/Archives/edgar/data/9300102/000930010222000002/10kt2021.txt",
      "representation": "plain_text",
      "admission": "single_sgml_document",
      "document_blocks": 1,
      "declared_type": "10-KT",
      "declared_filename": "10kt2021.txt"
    },
    {
      "cik": "0009300103",
      "accession": "0009300103-22-000003",
      "form": "10-K",
      "stratum": "domestic",
      "baseline_filing_date": "2022-05-01",
      "local_filename": "text-item2-fallback.txt",
      "source_sha256": "73e1c79cb7359d8e669f78383ccd33b56368dd4910646fd406a4e0dace9abdda",
      "source_byte_length": 382,
      "filing_index_url": "https://www.sec.gov/Archives/edgar/data/9300103/000930010322000003/0009300103-22-000003-index.htm",
      "filing_index_response_sha256": "0000000000000000000000000000000000000000000000000000000000000000",
      "selected_document": "item2.txt",
      "primary_url": "https://www.sec.gov/Archives/edgar/data/9300103/000930010322000003/item2.txt",
      "representation": "plain_text",
      "admission": "single_sgml_document",
      "document_blocks": 1,
      "declared_type": "10-K",
      "declared_filename": "item2.txt"
    },
    {
      "cik": "0009300104",
      "accession": "0009300104-22-000004",
      "form": "10-K",
      "stratum": "domestic",
      "baseline_filing_date": "2022-06-01",
      "local_filename": "text-toc-only.txt",
      "source_sha256": "a00ae1ed9b8b895bd6f28873dd206c43f5518276a16b70eba7f5323dcbed8c97",
      "source_byte_length": 455,
      "filing_index_url": "https://www.sec.gov/Archives/edgar/data/9300104/000930010422000004/0009300104-22-000004-index.htm",
      "filing_index_response_sha256": "0000000000000000000000000000000000000000000000000000000000000000",
      "selected_document": "toconly.txt",
      "primary_url": "https://www.sec.gov/Archives/edgar/data/9300104/000930010422000004/toconly.txt",
      "representation": "plain_text",
      "admission": "single_sgml_document",
      "document_blocks": 1,
      "declared_type": "10-K",
      "declared_filename": "toconly.txt"
    },
    {
      "cik": "0009300105",
      "accession": "0009300105-22-000005",
      "form": "10-K",
      "stratum": "domestic",
      "baseline_filing_date": "2022-07-01",
      "local_filename": "text-inline-1a-reference.txt",
      "source_sha256": "60ba22c46c2f309f93fb81342e3b3ec73c935eeea8af452704ebb96763bcd89e",
      "source_byte_length": 442,
      "filing_index_url": "https://www.sec.gov/Archives/edgar/data/9300105/000930010522000005/0009300105-22-000005-index.htm",
      "filing_index_response_sha256": "0000000000000000000000000000000000000000000000000000000000000000",
      "selected_document": "inline1a.txt",
      "primary_url": "https://www.sec.gov/Archives/edgar/data/9300105/000930010522000005/inline1a.txt",
      "representation": "plain_text",
      "admission": "single_sgml_document",
      "document_blocks": 1,
      "declared_type": "10-K",
      "declared_filename": "inline1a.txt"
    },
    {
      "cik": "0009300106",
      "accession": "0009300106-22-000006",
      "form": "10-K",
      "stratum": "domestic",
      "baseline_filing_date": "2022-08-01",
      "local_filename": "text-duplicate-boundaries.txt",
      "source_sha256": "e2c5117a6034f4ce138e6f95d9dc9dca8300e701d114799a289a404cafb966dc",
      "source_byte_length": 426,
      "filing_index_url": "https://www.sec.gov/Archives/edgar/data/9300106/000930010622000006/0009300106-22-000006-index.htm",
      "filing_index_response_sha256": "0000000000000000000000000000000000000000000000000000000000000000",
      "selected_document": "dup1a.txt",
      "primary_url": "https://www.sec.gov/Archives/edgar/data/9300106/000930010622000006/dup1a.txt",
      "representation": "plain_text",
      "admission": "single_sgml_document",
      "document_blocks": 1,
      "declared_type": "10-K",
      "declared_filename": "dup1a.txt"
    },
    {
      "cik": "0009300107",
      "accession": "0009300107-22-000007",
      "form": "10-K",
      "stratum": "domestic",
      "baseline_filing_date": "2022-09-01",
      "local_filename": "text-no-item-one.txt",
      "source_sha256": "180d876f54951d4317893bc951641e7e1a4d70a1968b7a49d3e460eb6d2b12ce",
      "source_byte_length": 351,
      "filing_index_url": "https://www.sec.gov/Archives/edgar/data/9300107/000930010722000007/0009300107-22-000007-index.htm",
      "filing_index_response_sha256": "0000000000000000000000000000000000000000000000000000000000000000",
      "selected_document": "noitem1.txt",
      "primary_url": "https://www.sec.gov/Archives/edgar/data/9300107/000930010722000007/noitem1.txt",
      "representation": "plain_text",
      "admission": "single_sgml_document",
      "document_blocks": 1,
      "declared_type": "10-K",
      "declared_filename": "noitem1.txt"
    },
    {
      "cik": "0009300108",
      "accession": "0009300108-22-000008",
      "form": "10-K",
      "stratum": "domestic",
      "baseline_filing_date": "2022-10-01",
      "local_filename": "text-bare-no-wrapper.txt",
      "source_sha256": "ef2f1054e9948cecafb25152bd2abb8129d04609db2f931f07ee3b37fa4dcc62",
      "source_byte_length": 356,
      "filing_index_url": "https://www.sec.gov/Archives/edgar/data/9300108/000930010822000008/0009300108-22-000008-index.htm",
      "filing_index_response_sha256": "0000000000000000000000000000000000000000000000000000000000000000",
      "selected_document": "bare2021.txt",
      "primary_url": "https://www.sec.gov/Archives/edgar/data/9300108/000930010822000008/bare2021.txt",
      "representation": "plain_text",
      "admission": "bare_text",
      "document_blocks": 0,
      "declared_type": null,
      "declared_filename": null
    }
  ]
}
